{
  "$schema": "https://json-schema.org/draft/2020-12/schema",
  "type": "array",
  "items": {
    "type": "object",
    "required": ["id", "project", "task", "column", "tags"],
    "properties": {
      "id": { "type": "integer", "minimum": 1 },
      "project": { "type": "string", "minLength": 1 },
      "task": { "type": "string", "minLength": 1 },
      "column": { "type": "string", "minLength": 1 },
      "tags": {
        "type": "array",
        "items": { "type": "string", "minLength": 1 },
        "minItems": 1
      }
    },
    "additionalProperties": false
  }
}
