[
  {
    "id": 1,
    "project": "Web Application",
    "task": "Implement user authentication",
    "column": "To Do",
    "tags": ["Feature", "High Priority"]
  },
  {
    "id": 2,
    "project": "Web Application",
    "task": "Fix navigation bug",
    "column": "To Do",
    "tags": ["Bug"]
  },
  {
    "id": 3,
    "project": "Web Application",
    "task": "Design system updates",
    "column": "In Progress",
    "tags": ["Design"]
  },
  {
    "id": 4,
    "project": "Mobile Application",
    "task": "Push notification system",
    "column": "To Do",
    "tags": ["Feature"]
  },
  {
    "id": 5,
    "project": "Mobile Application",
    "task": "Offline mode",
    "column": "In Progress",
    "tags": ["Feature", "High Priority"]
  },
  {
    "id": 6,
    "project": "Mobile Application",
    "task": "App icon design",
    "column": "Done",
    "tags": ["Design"]
  }
]